{
  "scope": "hero",
  "behavior_required": false,
  "files": {
    "html": "dist/hero.html",
    "source_intake": "reports/source_intake.json",
    "h2d_unpack_report": "reports/h2d_unpack_report.json",
    "rect_targets": "reports/rect_targets.json",
    "asset_map": "reports/asset_map.json",
    "asset_paint_validation": "reports/asset_paint_validation.json",
    "node_validation": "reports/node_validation.json",
    "behavior_validation": "reports/behavior_validation.json",
    "review": "reports/review.md",
    "liveness_validation": "reports/liveness_validation.json"
  },
  "liveness_required": false
}